{"actuators":[{"actuator_id":"actuator-left-hip-yaw","blockers":["installed_model_hardware_firmware_identity_missing","native_protocol_revision_applicability_unverified","exclusive_bus_route_node_owner_missing","evidenced_joint_and_drive_limits_missing","physical_zero_sign_ratio_calibration_missing","accepted_cad_output_member_and_joint_binding_missing","ros_joint_to_actuator_mapping_unresolved","independent_safe_power_and_hil_evidence_missing","external_joint_feedback_missing"],"cad_binding":{"asset_id":null,"housing_member":null,"joint_axis_xyz":null,"joint_origin_xyz_m":null,"output_member":null,"status":"unknown"},"calibration":{"calibration_id":null,"home_or_hard_stop_procedure":null,"invalidation_conditions":[],"motor_to_joint_sign":null,"operator_id":null,"output_per_motor_ratio":null,"recorded_at":null,"status":"missing","tool_id":null,"zero_reference_rad":null},"canonical_joint_name":"left_hip_yaw","chirality":"left","feedback":{"external_sensor_id":null,"external_sensor_status":"missing","native_drive_status":"unknown"},"installed_identity":{"control_mode":null,"drive_firmware":null,"hardware_revision":null,"manufacturer":null,"model":null,"protocol_name":null,"protocol_revision":null,"series":null,"status":"unresolved","transport":null},"limit_provenance":{"effective_limit":null,"measured_safe_limit":null,"runtime_derate":null,"software_limit":null,"status":"missing","vendor_rating":null},"low_level_observation":{"arithmetic_candidate_node_id":9,"candidate_is_installed_route":false,"evidence_status":"unverified_command_address_observation","legacy_request_arbitration_id":329,"source_id":"legacy_low_level"},"mapping_status":"unresolved_no_guess","motion_ready":false,"ros_joint_ids":[],"route":{"bus_id":null,"native_node_id":null,"owner_controller_node_id":null,"status":"unresolved"},"semantic_joint":"hip_yaw"},{"actuator_id":"actuator-left-hip-roll","blockers":["installed_model_hardware_firmware_identity_missing","native_protocol_revision_applicability_unverified","exclusive_bus_route_node_owner_missing","evidenced_joint_and_drive_limits_missing","physical_zero_sign_ratio_calibration_missing","accepted_cad_output_member_and_joint_binding_missing","ros_joint_to_actuator_mapping_unresolved","independent_safe_power_and_hil_evidence_missing"],"cad_binding":{"asset_id":null,"housing_member":null,"joint_axis_xyz":null,"joint_origin_xyz_m":null,"output_member":null,"status":"unknown"},"calibration":{"calibration_id":null,"home_or_hard_stop_procedure":null,"invalidation_conditions":[],"motor_to_joint_sign":null,"operator_id":null,"output_per_motor_ratio":null,"recorded_at":null,"status":"missing","tool_id":null,"zero_reference_rad":null},"canonical_joint_name":"left_hip_roll","chirality":"left","feedback":{"external_sensor_id":"left-hip-roll-external","external_sensor_status":"unverified_observation","native_drive_status":"unknown"},"installed_identity":{"control_mode":null,"drive_firmware":null,"hardware_revision":null,"manufacturer":null,"model":null,"protocol_name":null,"protocol_revision":null,"series":null,"status":"unresolved","transport":null},"limit_provenance":{"effective_limit":null,"measured_safe_limit":null,"runtime_derate":null,"software_limit":null,"status":"missing","vendor_rating":null},"low_level_observation":{"arithmetic_candidate_node_id":10,"candidate_is_installed_route":false,"evidence_status":"unverified_command_address_observation","legacy_request_arbitration_id":330,"source_id":"legacy_low_level"},"mapping_status":"unresolved_no_guess","motion_ready":false,"ros_joint_ids":[],"route":{"bus_id":null,"native_node_id":null,"owner_controller_node_id":null,"status":"unresolved"},"semantic_joint":"hip_roll"},{"actuator_id":"actuator-left-hip-pitch","blockers":["installed_model_hardware_firmware_identity_missing","native_protocol_revision_applicability_unverified","exclusive_bus_route_node_owner_missing","evidenced_joint_and_drive_limits_missing","physical_zero_sign_ratio_calibration_missing","accepted_cad_output_member_and_joint_binding_missing","ros_joint_to_actuator_mapping_unresolved","independent_safe_power_and_hil_evidence_missing"],"cad_binding":{"asset_id":null,"housing_member":null,"joint_axis_xyz":null,"joint_origin_xyz_m":null,"output_member":null,"status":"unknown"},"calibration":{"calibration_id":null,"home_or_hard_stop_procedure":null,"invalidation_conditions":[],"motor_to_joint_sign":null,"operator_id":null,"output_per_motor_ratio":null,"recorded_at":null,"status":"missing","tool_id":null,"zero_reference_rad":null},"canonical_joint_name":"left_hip_pitch","chirality":"left","feedback":{"external_sensor_id":"left-hip-pitch-external","external_sensor_status":"unverified_observation","native_drive_status":"unknown"},"installed_identity":{"control_mode":null,"drive_firmware":null,"hardware_revision":null,"manufacturer":null,"model":null,"protocol_name":null,"protocol_revision":null,"series":null,"status":"unresolved","transport":null},"limit_provenance":{"effective_limit":null,"measured_safe_limit":null,"runtime_derate":null,"software_limit":null,"status":"missing","vendor_rating":null},"low_level_observation":{"arithmetic_candidate_node_id":6,"candidate_is_installed_route":false,"evidence_status":"unverified_command_address_observation","legacy_request_arbitration_id":326,"source_id":"legacy_low_level"},"mapping_status":"unresolved_no_guess","motion_ready":false,"ros_joint_ids":[],"route":{"bus_id":null,"native_node_id":null,"owner_controller_node_id":null,"status":"unresolved"},"semantic_joint":"hip_pitch"},{"actuator_id":"actuator-left-knee","blockers":["installed_model_hardware_firmware_identity_missing","native_protocol_revision_applicability_unverified","exclusive_bus_route_node_owner_missing","evidenced_joint_and_drive_limits_missing","physical_zero_sign_ratio_calibration_missing","accepted_cad_output_member_and_joint_binding_missing","ros_joint_to_actuator_mapping_unresolved","independent_safe_power_and_hil_evidence_missing"],"cad_binding":{"asset_id":null,"housing_member":null,"joint_axis_xyz":null,"joint_origin_xyz_m":null,"output_member":null,"status":"unknown"},"calibration":{"calibration_id":null,"home_or_hard_stop_procedure":null,"invalidation_conditions":[],"motor_to_joint_sign":null,"operator_id":null,"output_per_motor_ratio":null,"recorded_at":null,"status":"missing","tool_id":null,"zero_reference_rad":null},"canonical_joint_name":"left_knee","chirality":"left","feedback":{"external_sensor_id":"left-knee-external","external_sensor_status":"unverified_observation","native_drive_status":"unknown"},"installed_identity":{"control_mode":null,"drive_firmware":null,"hardware_revision":null,"manufacturer":null,"model":null,"protocol_name":null,"protocol_revision":null,"series":null,"status":"unresolved","transport":null},"limit_provenance":{"effective_limit":null,"measured_safe_limit":null,"runtime_derate":null,"software_limit":null,"status":"missing","vendor_rating":null},"low_level_observation":{"arithmetic_candidate_node_id":5,"candidate_is_installed_route":false,"evidence_status":"unverified_command_address_observation","legacy_request_arbitration_id":325,"source_id":"legacy_low_level"},"mapping_status":"unresolved_no_guess","motion_ready":false,"ros_joint_ids":[],"route":{"bus_id":null,"native_node_id":null,"owner_controller_node_id":null,"status":"unresolved"},"semantic_joint":"knee"},{"actuator_id":"actuator-left-inner-calf","blockers":["installed_model_hardware_firmware_identity_missing","native_protocol_revision_applicability_unverified","exclusive_bus_route_node_owner_missing","evidenced_joint_and_drive_limits_missing","physical_zero_sign_ratio_calibration_missing","accepted_cad_output_member_and_joint_binding_missing","ros_joint_to_actuator_mapping_unresolved","independent_safe_power_and_hil_evidence_missing"],"cad_binding":{"asset_id":null,"housing_member":null,"joint_axis_xyz":null,"joint_origin_xyz_m":null,"output_member":null,"status":"unknown"},"calibration":{"calibration_id":null,"home_or_hard_stop_procedure":null,"invalidation_conditions":[],"motor_to_joint_sign":null,"operator_id":null,"output_per_motor_ratio":null,"recorded_at":null,"status":"missing","tool_id":null,"zero_reference_rad":null},"canonical_joint_name":"left_inner_calf","chirality":"left","feedback":{"external_sensor_id":"left-inner-calf-external","external_sensor_status":"unverified_observation","native_drive_status":"unknown"},"installed_identity":{"control_mode":null,"drive_firmware":null,"hardware_revision":null,"manufacturer":null,"model":null,"protocol_name":null,"protocol_revision":null,"series":null,"status":"unresolved","transport":null},"limit_provenance":{"effective_limit":null,"measured_safe_limit":null,"runtime_derate":null,"software_limit":null,"status":"missing","vendor_rating":null},"low_level_observation":{"arithmetic_candidate_node_id":2,"candidate_is_installed_route":false,"evidence_status":"unverified_command_address_observation","legacy_request_arbitration_id":322,"source_id":"legacy_low_level"},"mapping_status":"unresolved_no_guess","motion_ready":false,"ros_joint_ids":[],"route":{"bus_id":null,"native_node_id":null,"owner_controller_node_id":null,"status":"unresolved"},"semantic_joint":"inner_calf"},{"actuator_id":"actuator-left-outer-calf","blockers":["installed_model_hardware_firmware_identity_missing","native_protocol_revision_applicability_unverified","exclusive_bus_route_node_owner_missing","evidenced_joint_and_drive_limits_missing","physical_zero_sign_ratio_calibration_missing","accepted_cad_output_member_and_joint_binding_missing","ros_joint_to_actuator_mapping_unresolved","independent_safe_power_and_hil_evidence_missing"],"cad_binding":{"asset_id":null,"housing_member":null,"joint_axis_xyz":null,"joint_origin_xyz_m":null,"output_member":null,"status":"unknown"},"calibration":{"calibration_id":null,"home_or_hard_stop_procedure":null,"invalidation_conditions":[],"motor_to_joint_sign":null,"operator_id":null,"output_per_motor_ratio":null,"recorded_at":null,"statu